{
  "id": "reviewer",
  "parts": [
    { "file": "parts/01-claude.md", "tag": "claude" },
    { "file": "parts/01-prior.md", "tag": "prior" },
    { "file": "parts/02-neutral.md", "tag": "neutral" },
    { "file": "parts/03-claude.md", "tag": "claude" },
    { "file": "parts/03-prior.md", "tag": "prior" },
    { "file": "parts/04-neutral.md", "tag": "neutral" },
    { "file": "parts/05-claude.md", "tag": "claude" },
    { "file": "parts/05-prior.md", "tag": "prior" },
    { "file": "parts/06-neutral.md", "tag": "neutral" },
    { "file": "parts/07-claude.md", "tag": "claude" },
    { "file": "parts/07-prior.md", "tag": "prior" },
    { "file": "parts/08-neutral.md", "tag": "neutral" },
    { "file": "parts/09-claude.md", "tag": "claude" },
    { "file": "parts/09-prior.md", "tag": "prior" },
    { "file": "parts/10-neutral.md", "tag": "neutral" },
    { "file": "parts/11-claude.md", "tag": "claude" },
    { "file": "parts/11-prior.md", "tag": "prior" },
    { "file": "parts/12-neutral.md", "tag": "neutral" },
    { "file": "parts/13-claude.md", "tag": "claude" },
    { "file": "parts/13-prior.md", "tag": "prior" },
    { "file": "parts/14-neutral.md", "tag": "neutral" },
    { "file": "parts/15-claude.md", "tag": "claude" },
    { "file": "parts/15-prior.md", "tag": "prior" },
    { "file": "parts/16-neutral.md", "tag": "neutral" },
    { "file": "parts/17-claude.md", "tag": "claude" },
    { "file": "parts/17-prior.md", "tag": "prior" },
    { "file": "parts/18-neutral.md", "tag": "neutral" }
  ],
  "input_schema": "schemas/review-request.v1.json",
  "result_schema": "schemas/review-response.v1.json",
  "tools_ceiling": ["read", "list", "search"],
  "may_delegate": false,
  "writes_workbench": { "claude-code": true, "prior": false },
  "execution_policy": { "claude-code": "claude-guided", "prior": "prior-enforced" }
}
